{
  "$schema": "https://json-schema.org/draft/2020-12/schema",
  "$id": "https://h2a-protocol.org/schemas/v0/h2a-core.attestation.schema.json",
  "title": "H2A Core Attestation",
  "description": "Signed receipt of a single act of use, binding the committed output to the grant and to the point-of-use status check that authorised it.",
  "type": "object",
  "additionalProperties": false,
  "required": [
    "h2a_version",
    "attestation_id",
    "grant_id",
    "subject_ref",
    "grantee_ref",
    "output_hash",
    "status_check",
    "alg",
    "signature",
    "created_at"
  ],
  "properties": {
    "h2a_version": { "type": "string", "const": "0.1" },
    "attestation_id": { "type": "string", "pattern": "^[0-9a-fA-F-]{36}$" },
    "grant_id": { "type": "string", "pattern": "^[0-9a-fA-F-]{36}$" },
    "subject_ref": { "type": "string", "pattern": "^urn:h2a:subject:[A-Za-z0-9._-]+$" },
    "grantee_ref": { "type": "string", "pattern": "^urn:h2a:grantee:[A-Za-z0-9._-]+$" },
    "output_hash": {
      "type": "string",
      "description": "SHA-256 of the committed output.",
      "pattern": "^sha256:[0-9a-f]{64}$"
    },
    "use": {
      "type": "object",
      "description": "The use this attestation actually attests: what was checked at the moment of the act, not what the grant permits in general. Optional so objects written before this field existed stay valid, but SHOULD be present — an attestation that does not say what use it attests records only that something happened, which is a decoration rather than evidence (Bridle defect B6). A verifier comparing this against the grant's scope is what makes the attestation checkable offline.",
      "additionalProperties": false,
      "properties": {
        "purpose": { "type": "string", "description": "The single purpose checked, drawn from the grant's scope.purposes." },
        "territory": { "type": "string", "description": "ISO 3166-1 alpha-2 or 'GLOBAL'." },
        "spend": {
          "type": "object",
          "description": "What this act drew against the grant's lease, in the lease's own unit.",
          "additionalProperties": false,
          "required": ["amount", "unit"],
          "properties": {
            "amount": { "type": "number", "minimum": 0 },
            "unit": { "type": "string", "description": "MUST match the grant's lease.unit; a spend in a different unit is not comparable to the cap." }
          }
        }
      }
    },
    "decision_record_ref": {
      "type": "string",
      "description": "record_id of the Decision Record this attestation was emitted under. Optional for backwards compatibility, but without it the attestation and the decision that authorised it cannot be tied together by a third party — which is the join a stranger needs to verify the act offline."
    },
    "generator": {
      "type": "object",
      "description": "What produced the output. The operator governs, never generates — generation is outsourced to a third-party generation provider via an implementer's adapter.",
      "additionalProperties": false,
      "properties": {
        "adapter": { "type": "string" },
        "provider": { "type": "string" },
        "model": { "type": "string" }
      }
    },
    "status_check": {
      "type": "object",
      "description": "The check performed at the point of use. Never cached; always live.",
      "additionalProperties": false,
      "required": ["result", "checked_at"],
      "properties": {
        "result": { "type": "string", "enum": ["valid", "refused"] },
        "reason_code": { "type": "string", "description": "e.g. asset-revoked, out-of-scope, lease-exhausted." },
        "checked_at": { "type": "string", "format": "date-time" },
        "status_uri": { "type": "string", "format": "uri" },
        "witness_beacon": { "type": "string", "description": "Reference to the external timestamp/beacon the check was bracketed against (ADR-005)." }
      }
    },
    "alg": { "type": "string", "enum": ["ES256", "ES384", "EdDSA"], "default": "ES256" },
    "signature": { "type": "string", "description": "base64url signature over the canonicalised attestation." },
    "created_at": { "type": "string", "format": "date-time" }
  }
}
