{
  "h2a_version": "0.1",
  "attestation_id": "7c9e6a10-1111-4b2a-9c33-8a1b2c3d4e5f",
  "grant_id": "3f2a1c40-0d1e-4b2a-9c33-8a1b2c3d4e5f",
  "subject_ref": "urn:h2a:subject:jane-actor-001",
  "grantee_ref": "urn:h2a:grantee:example-operator",
  "output_hash": "sha256:aaaaaaaaaaaaaaaaaaaaaaaaaaaaaaaaaaaaaaaaaaaaaaaaaaaaaaaaaaaaaaaa",
  "generator": { "adapter": "example-adapter", "provider": "example-provider", "model": "avatar-v3" },
  "status_check": {
    "result": "valid",
    "checked_at": "2026-07-20T14:03:00Z",
    "status_uri": "https://issuer.example.org/h2a/status/2026-q3.json",
    "witness_beacon": "beacon:2026-07-20T14:02:59Z:ab12"
  },
  "alg": "ES256",
  "signature": "BASE64URL_SIG",
  "created_at": "2026-07-20T14:03:01Z"
}
